{
  "slug": "rinvoq-ad",
  "drug": "Rinvoq",
  "indication": "Atopic Dermatitis",
  "indication_short": "AD",
  "vial_sizes": [
    "15 mg tablet",
    "30 mg tablet"
  ],
  "route": "oral",
  "age_bands": [
    {
      "label": "Adults and adolescents (patient quick reference)",
      "label_short": "Adults",
      "weights": [
        {
          "label": "starting dose",
          "loading": null,
          "maintenance": {
            "value": "15 mg",
            "frequency": "once daily",
            "n_injections": 1,
            "notes": "15 mg once daily tablet."
          }
        },
        {
          "label": "escalated dose",
          "loading": null,
          "maintenance": {
            "value": "30 mg",
            "frequency": "once daily",
            "n_injections": 1,
            "notes": "30 mg once daily tablet."
          }
        }
      ]
    }
  ],
  "supply_notes": [
    "Take with or without food.",
    "Swallow the tablet whole. Do NOT split, crush, or chew.",
    "Avoid grapefruit while on RINVOQ."
  ],
  "source": {
    "file": "rinvoq_infographic.html",
    "extracted_on": "2026-05-19"
  },
  "reviewed": {
    "by": null,
    "date": null
  }
}
