{
  "slug": "taltz-pso-peds",
  "drug": "Taltz",
  "indication": "Plaque Psoriasis (Pediatric)",
  "indication_short": "PsO Peds",
  "vial_sizes": [
    "20 mg / mL",
    "40 mg / mL",
    "80 mg / mL"
  ],
  "route": "subcutaneous",
  "age_bands": [
    {
      "label": "Pediatric (kids and teens, weight-based)",
      "label_short": "Pediatric",
      "weights": [
        {
          "label": "> 110 lb",
          "loading": {
            "value": "160 mg",
            "n_injections": 2,
            "notes": "Week 0: two 80 mg injections on the same day (160 mg total)."
          },
          "maintenance": {
            "value": "80 mg",
            "frequency": "every 4 weeks",
            "n_injections": 1,
            "notes": "One injection every 4 weeks starting at week 4."
          }
        },
        {
          "label": "55–110 lb",
          "loading": {
            "value": "80 mg",
            "n_injections": 1,
            "notes": "Week 0: one 80 mg injection."
          },
          "maintenance": {
            "value": "40 mg",
            "frequency": "every 4 weeks",
            "n_injections": 1,
            "notes": "One 40 mg injection every 4 weeks starting at week 4."
          }
        },
        {
          "label": "< 55 lb",
          "loading": {
            "value": "40 mg",
            "n_injections": 1,
            "notes": "Week 0: one 40 mg injection."
          },
          "maintenance": {
            "value": "20 mg",
            "frequency": "every 4 weeks",
            "n_injections": 1,
            "notes": "One 20 mg injection every 4 weeks starting at week 4."
          }
        }
      ]
    }
  ],
  "supply_notes": [
    "Source: Taltz pediatric psoriasis dosing infographic (Taltz Peds.png). Dosing for kids and teens is based on weight."
  ],
  "source": {
    "file": "taltz-peds-print.html",
    "extracted_on": "2026-05-19"
  },
  "reviewed": {
    "by": null,
    "date": null
  }
}
