{
  "slug": "bimzelx-hs",
  "drug": "Bimzelx",
  "indication": "Hidradenitis Suppurativa",
  "indication_short": "HS",
  "vial_sizes": [
    "320 mg / 2 mL"
  ],
  "route": "subcutaneous",
  "age_bands": [
    {
      "label": "Adults",
      "label_short": "Adults",
      "weights": [
        {
          "label": "all weights",
          "loading": {
            "value": "320 mg",
            "n_injections": 1,
            "notes": "1 × 320 mg subcutaneously every 2 weeks at weeks 0, 2, 4, 6, 8, 10, 12, 14"
          },
          "maintenance": {
            "value": "320 mg",
            "frequency": "every 4 weeks",
            "n_injections": 1,
            "notes": "Starting week 16."
          }
        }
      ]
    }
  ],
  "supply_notes": [
    "Same dosing regardless of device preference (autoinjector or syringe)."
  ],
  "source": {
    "file": "bimzelx-HS.html",
    "extracted_on": "2026-05-19"
  },
  "reviewed": {
    "by": null,
    "date": null
  }
}
