{
  "slug": "sotyktu-pso",
  "drug": "Sotyktu",
  "indication": "Plaque Psoriasis",
  "indication_short": "PsO",
  "vial_sizes": [
    "6 mg tablet"
  ],
  "route": "oral",
  "age_bands": [
    {
      "label": "Adults (patient quick reference)",
      "label_short": "Adults",
      "weights": [
        {
          "label": "all weights",
          "loading": null,
          "maintenance": {
            "value": "6 mg",
            "frequency": "once daily",
            "n_injections": 1,
            "notes": "6 mg once daily tablet."
          }
        }
      ]
    }
  ],
  "supply_notes": [
    "Take with or without food. No dietary restrictions.",
    "Swallow the tablet whole."
  ],
  "source": {
    "file": "sotyktu_infographic.html",
    "extracted_on": "2026-05-19"
  },
  "reviewed": {
    "by": null,
    "date": null
  }
}
