{
  "slug": "bimzelx-pso",
  "drug": "Bimzelx",
  "indication": "Plaque Psoriasis",
  "indication_short": "PsO",
  "vial_sizes": [
    "320 mg / 2 mL"
  ],
  "route": "subcutaneous",
  "age_bands": [
    {
      "label": "Adults",
      "label_short": "Adults",
      "weights": [
        {
          "label": "< 120 kg",
          "loading": {
            "value": "320 mg",
            "n_injections": 1,
            "notes": "1 × 320 mg every 4 weeks at weeks 0, 4, 8, and 12"
          },
          "maintenance": {
            "value": "320 mg",
            "frequency": "every 8 weeks",
            "n_injections": 1,
            "notes": "1 × 320 mg at week 16, then every 8 weeks."
          }
        },
        {
          "label": "≥ 120 kg",
          "loading": {
            "value": "320 mg",
            "n_injections": 1,
            "notes": "1 × 320 mg every 4 weeks at weeks 0, 4, 8, and 12"
          },
          "maintenance": {
            "value": "320 mg",
            "frequency": "every 4 weeks",
            "n_injections": 1,
            "notes": "1 × 320 mg at week 16, then every 4 weeks."
          }
        }
      ]
    }
  ],
  "supply_notes": [
    "Same dosing regardless of device preference (autoinjector or syringe)."
  ],
  "source": {
    "file": "bimzelx-pso.html",
    "extracted_on": "2026-05-19"
  },
  "reviewed": {
    "by": null,
    "date": null
  }
}
