{
  "slug": "skyrizi-pso",
  "drug": "Skyrizi",
  "indication": "Plaque Psoriasis",
  "indication_short": "PsO",
  "vial_sizes": [
    "150 mg / mL"
  ],
  "route": "subcutaneous",
  "age_bands": [
    {
      "label": "Adults",
      "label_short": "Adults",
      "weights": [
        {
          "label": "all weights",
          "loading": {
            "value": "150 mg",
            "n_injections": 1,
            "notes": "Inject 150 mg SC at week 0 and week 4."
          },
          "maintenance": {
            "value": "150 mg",
            "frequency": "every 12 weeks",
            "n_injections": 1
          }
        }
      ]
    }
  ],
  "supply_notes": [
    "Same dosing regardless of device preference (pen or syringe)."
  ],
  "source": {
    "file": "skyrizi-flowchart.html",
    "extracted_on": "2026-05-19"
  },
  "reviewed": {
    "by": null,
    "date": null
  }
}
