{
  "slug": "cosentyx-hs",
  "drug": "Cosentyx",
  "indication": "Hidradenitis Suppurativa",
  "indication_short": "HS",
  "vial_sizes": [],
  "route": "subcutaneous",
  "age_bands": [
    {
      "label": "Pediatric (12+ Years)",
      "label_short": "Pediatric",
      "weights": [
        {
          "label": "66–198 lbs",
          "loading": {
            "value": "150 mg",
            "n_injections": 1
          },
          "maintenance": {
            "value": "150 mg",
            "frequency": "every 4 weeks",
            "n_injections": 1
          }
        },
        {
          "label": "≥ 198 lbs",
          "loading": {
            "value": "300 mg",
            "n_injections": 1
          },
          "maintenance": {
            "value": "300 mg",
            "frequency": "every 4 weeks",
            "n_injections": 1
          }
        }
      ]
    },
    {
      "label": "Adults (18+ Years)",
      "label_short": "Adults",
      "weights": [
        {
          "label": "all weights",
          "loading": {
            "value": "300 mg",
            "n_injections": 1
          },
          "maintenance": {
            "value": "300 mg",
            "frequency": "every 4 weeks",
            "n_injections": 1
          }
        }
      ]
    }
  ],
  "supply_notes": [
    "UnoReady Pen:",
    "300 mg/2 mL  •",
    "SensoReady Pen:",
    "150 mg/mL  •",
    "Prefilled Syringe:",
    "150 mg/mL or 75 mg/0.5 mL"
  ],
  "source": {
    "file": "Cosentyx HS.html",
    "extracted_on": "2026-05-19"
  },
  "reviewed": {
    "by": null,
    "date": null
  }
}
